{
  "meta": {
    "resolution": [1080, 1920],
    "fps": 30,
    "duration": 8,
    "colorSpace": "sRGB"
  },
  "assets": {
    "assets": {
      "v1": {
        "type": "video",
        "src": "/test-video.mp4",
        "semanticRole": "main"
      },
      "t1": {
        "type": "text",
        "content": "ğŸµ è§†é¢‘åŸå£°è·Ÿéšå˜é€Ÿï¼ˆæ— éœ€éŸ³é¢‘è½¨ï¼‰",
        "editable": true
      }
    }
  },
  "vocabulary": {
    "expressions": {
      "fade-in": { "category": "entrance", "semantic": "æ¸å…¥" },
      "fade-out": { "category": "exit", "semantic": "æ¸å‡º" }
    },
    "presets": {
      "title-variety": { "type": "textStyle", "category": "ç»¼è‰º", "anchor": "center" }
    },
    "filters": {}
  },
  "timeline": {
    "tracks": [
      {
        "id": "track-video",
        "type": "video",
        "layer": 0,
        "clips": [
          {
            "id": "clip-v1",
            "asset": "v1",
            "time": { "start": 0, "end": 8 }
          }
        ]
      },
      {
        "id": "track-title",
        "type": "text",
        "layer": 1,
        "clips": [
          {
            "id": "clip-t1",
            "asset": "t1",
            "time": { "start": 0, "end": 3.5 },
            "expression": { "preset": "title-variety", "intensity": 1.0 },
            "behavior": { "enter": "fade-in", "exit": "fade-out" }
          }
        ]
      }
    ]
  },
  "adjustments": {
    "clipOverrides": {
      "clip-v1": {
        "video": {
          "timeWarp": {
            "mode": "ramp",
            "segments": [
              { "when": { "start": 0, "end": 4 }, "speed": 0.6, "easing": "ease-in-out" },
              { "when": { "start": 4, "end": 8 }, "speed": 1.8, "easing": "ease-in-out" }
            ]
          }
        }
      }
    }
  }
}


