{
  "meta": {
    "resolution": [1080, 1920],
    "fps": 30,
    "duration": 30,
    "colorSpace": "sRGB"
  },
  "assets": {
    "assets": {
      "bg-video": {
        "type": "video",
        "src": "/test-video.mp4",
        "semanticRole": "background"
      },
      "main-title": {
        "type": "text",
        "content": "ğŸ¬ AI å‰ªè¾‘å¤§å¸ˆ",
        "editable": true,
        "semanticRole": "title"
      },
      "subtitle-intro": {
        "type": "text",
        "content": "æ™ºèƒ½è§†é¢‘åˆ›ä½œï¼Œä¸€é”®ç”Ÿæˆçˆ†æ¬¾",
        "editable": true
      },
      "subtitle-feature-1": {
        "type": "text",
        "content": "âœ¨ AI è‡ªåŠ¨å‰ªè¾‘",
        "editable": true
      },
      "subtitle-feature-2": {
        "type": "text",
        "content": "ğŸ¨ æ™ºèƒ½å­—å¹•ç”Ÿæˆ",
        "editable": true
      },
      "subtitle-feature-3": {
        "type": "text",
        "content": "ğŸš€ ä¸€é”®å¯¼å‡ºé«˜æ¸…è§†é¢‘",
        "editable": true
      },
      "subtitle-cta": {
        "type": "text",
        "content": "ç«‹å³ä½“éªŒ â†’",
        "editable": true
      },
      "watermark": {
        "type": "text",
        "content": "AutoCut Pro",
        "editable": false
      },
      "emphasis-text": {
        "type": "text",
        "content": "çˆ†æ¬¾ç¥å™¨ï¼",
        "editable": true
      }
    }
  },
  "vocabulary": {
    "expressions": {
      "fade-in": {
        "category": "entrance",
        "semantic": "æ¸å…¥æ•ˆæœ",
        "intensityRange": [0.3, 1.0]
      },
      "fade-out": {
        "category": "exit",
        "semantic": "æ¸å‡ºæ•ˆæœ",
        "intensityRange": [0.3, 1.0]
      },
      "bounce": {
        "category": "entrance",
        "semantic": "å¼¹è·³è¿›å…¥",
        "intensityRange": [0.4, 1.0]
      },
      "slide-up": {
        "category": "entrance",
        "semantic": "ä»ä¸‹å¾€ä¸Šæ»‘å…¥",
        "intensityRange": [0.5, 1.0]
      },
      "zoom": {
        "category": "entrance",
        "semantic": "ç¼©æ”¾è¿›å…¥",
        "intensityRange": [0.5, 1.0]
      },
      "shake": {
        "category": "emphasis",
        "semantic": "æŠ–åŠ¨å¼ºè°ƒ",
        "intensityRange": [0.3, 0.8]
      },
      "pulse": {
        "category": "emphasis",
        "semantic": "è„‰å†²æ•ˆæœ",
        "intensityRange": [0.4, 0.9]
      },
      "glow": {
        "category": "emphasis",
        "semantic": "å‘å…‰æ•ˆæœ",
        "intensityRange": [0.5, 1.0]
      }
    },
    "presets": {
      "title-variety": {
        "type": "textStyle",
        "category": "ç»¼è‰º",
        "anchor": "center"
      },
      "subtitle-bottom": {
        "type": "textStyle",
        "category": "ä¿¡æ¯",
        "anchor": "bottom"
      },
      "neon-glow": {
        "type": "textStyle",
        "category": "ç§‘æŠ€",
        "anchor": "center"
      },
      "gradient-pop": {
        "type": "textStyle",
        "category": "æ½®æµ",
        "anchor": "center"
      },
      "emphasis-center": {
        "type": "textStyle",
        "category": "å¼ºè°ƒ",
        "anchor": "center"
      },
      "watermark-corner": {
        "type": "textStyle",
        "category": "æ°´å°",
        "anchor": "top-right"
      }
    },
    "filters": {
      "vintage": {
        "semantic": "å¤å¤èƒ¶ç‰‡",
        "supportsIntensity": true
      },
      "warm": {
        "semantic": "æš–è‰²è°ƒ",
        "supportsIntensity": true
      },
      "cool": {
        "semantic": "å†·è‰²è°ƒ",
        "supportsIntensity": true
      },
      "bright": {
        "semantic": "æäº®",
        "supportsIntensity": true
      }
    }
  },
  "timeline": {
    "tracks": [
      {
        "id": "track-video",
        "type": "video",
        "layer": 0,
        "clips": [
          {
            "id": "clip-bg",
            "asset": "bg-video",
            "time": { "start": 0, "end": 30 }
          }
        ]
      },
      {
        "id": "track-title",
        "type": "text",
        "layer": 1,
        "clips": [
          {
            "id": "clip-title",
            "asset": "main-title",
            "time": { "start": 0, "end": 5 },
            "expression": {
              "preset": "title-variety",
              "intensity": 1.0
            },
            "behavior": {
              "enter": "bounce",
              "exit": "fade-out"
            }
          }
        ]
      },
      {
        "id": "track-subtitle",
        "type": "text",
        "layer": 2,
        "clips": [
          {
            "id": "clip-intro",
            "asset": "subtitle-intro",
            "time": { "start": 2, "end": 6 },
            "expression": {
              "preset": "subtitle-bottom",
              "intensity": 0.8
            },
            "behavior": {
              "enter": "slide-up",
              "exit": "fade-out"
            }
          },
          {
            "id": "clip-feature-1",
            "asset": "subtitle-feature-1",
            "time": { "start": 7, "end": 11 },
            "expression": {
              "preset": "neon-glow",
              "intensity": 0.9
            },
            "behavior": {
              "enter": "zoom",
              "exit": "fade-out"
            }
          },
          {
            "id": "clip-feature-2",
            "asset": "subtitle-feature-2",
            "time": { "start": 12, "end": 16 },
            "expression": {
              "preset": "gradient-pop",
              "intensity": 0.85
            },
            "behavior": {
              "enter": "slide-up",
              "exit": "fade-out"
            }
          },
          {
            "id": "clip-feature-3",
            "asset": "subtitle-feature-3",
            "time": { "start": 17, "end": 21 },
            "expression": {
              "preset": "subtitle-bottom",
              "intensity": 0.8
            },
            "behavior": {
              "enter": "fade-in",
              "exit": "fade-out"
            }
          },
          {
            "id": "clip-cta",
            "asset": "subtitle-cta",
            "time": { "start": 23, "end": 29 },
            "expression": {
              "preset": "emphasis-center",
              "intensity": 1.0
            },
            "behavior": {
              "enter": "bounce",
              "exit": "fade-out"
            }
          }
        ]
      },
      {
        "id": "track-emphasis",
        "type": "text",
        "layer": 3,
        "clips": [
          {
            "id": "clip-emphasis",
            "asset": "emphasis-text",
            "time": { "start": 25, "end": 28 },
            "expression": {
              "preset": "title-variety",
              "intensity": 1.0
            },
            "behavior": {
              "enter": "shake",
              "exit": "fade-out"
            }
          }
        ]
      },
      {
        "id": "track-watermark",
        "type": "text",
        "layer": 4,
        "clips": [
          {
            "id": "clip-watermark",
            "asset": "watermark",
            "time": { "start": 0, "end": 30 },
            "expression": {
              "preset": "watermark-corner",
              "intensity": 0.5
            },
            "behavior": {
              "enter": "fade-in"
            }
          }
        ]
      }
    ]
  },
  "annotations": {
    "clips": {
      "clip-title": {
        "anchors": [
          {
            "id": "anchor-title",
            "label": "ä¸»æ ‡é¢˜",
            "frame": 0,
            "editable": ["text", "style", "animation"]
          }
        ]
      },
      "clip-cta": {
        "anchors": [
          {
            "id": "anchor-cta",
            "label": "è¡ŒåŠ¨å·å¬",
            "frame": 690,
            "editable": ["text", "style"]
          }
        ]
      }
    }
  },
  "adjustments": {
    "clipOverrides": {
      "clip-bg": {
        "video": {
          "filter": {
            "id": "warm",
            "intensity": 0.25
          }
        }
      },
      "clip-title": {
        "time": {
          "offset": 0
        }
      }
    }
  }
}


